{
  "attempt_id": "flip2-hydro-20260721T021708Z",
  "commands": [
    ".venv/bin/python scripts/prepare_dataset.py --inventory configs/datasets/flip2/zenodo-18433203-v3/hydro.json --staging-root <outside-repository-staging-root>",
    "coscli cp <verified-task-file> cos://data/raw/flip2/zenodo-18433203-v3/hydro/<source-filename> --forbid-overwrite --err-retry-num 0",
    "coscli cp cos://data/raw/flip2/zenodo-18433203-v3/hydro/<source-filename> <temporary-readback-file>",
    "shasum -a 256 <temporary-readback-files>",
    "cmp <verified-files> <temporary-readback-files>",
    "coscli cp <dataset-manifest.json> cos://data/manifests/flip2/zenodo-18433203-v3/hydro/dataset-manifest.json --forbid-overwrite --err-retry-num 0",
    "coscli cp cos://data/manifests/flip2/zenodo-18433203-v3/hydro/dataset-manifest.json <temporary-readback-file>",
    "cmp <dataset-manifest.json> <temporary-readback-file>",
    ".venv/bin/python -m jsonschema -i <temporary-readback-file> schemas/dataset-manifest.schema.json",
    ".venv/bin/python -m pytest tests/datasets/test_ingest.py tests/contracts/test_schema_files.py"
  ],
  "dataset_id": "flip2",
  "dataset_manifest": {
    "object_key": "manifests/flip2/zenodo-18433203-v3/hydro/dataset-manifest.json",
    "revision": 1,
    "sha256": "5770fd53ff2117888edb5d21bff4f86dd6f9855ef105ce74ddbf2397244b6fcc",
    "size_bytes": 2492
  },
  "dataset_version": "zenodo-18433203-v3",
  "environment": {
    "cos_bucket_alias": "data",
    "cos_region": "ap-beijing",
    "coscli_version": "v1.0.8",
    "platform": "macOS-15.7.4-arm64",
    "python_version": "3.14.4"
  },
  "manifest_revision_git_commit": "528f3eca87ae462cc8cba537cadf67a2deb34282",
  "raw_ingest_git_commit": "528f3eca87ae462cc8cba537cadf67a2deb34282",
  "raw_objects": [
    {
      "object_key": "raw/flip2/zenodo-18433203-v3/hydro/README.md",
      "sha256": "274e7a53f92088cb156bf9b2a8c4397c89b477884fa63963ed2770de2cdaf406",
      "size_bytes": 430
    },
    {
      "object_key": "raw/flip2/zenodo-18433203-v3/hydro/random_split.csv.gz",
      "sha256": "9f84a5139f97fda454e059a6b22cdd7ade7aaba698f66f7ac6104747b204aee6",
      "size_bytes": 376954
    },
    {
      "object_key": "raw/flip2/zenodo-18433203-v3/hydro/three_to_many.csv.gz",
      "sha256": "76befc506e84e0ef0dd96fa4c8e5b41c6ec47e1664eccbf8804862f3ea97cb90",
      "size_bytes": 369389
    },
    {
      "object_key": "raw/flip2/zenodo-18433203-v3/hydro/low_to_high.csv.gz",
      "sha256": "30b89e3102fe67c1726ebc897a127221c89e224801d60ede509d1ca8dc7d612f",
      "size_bytes": 372137
    },
    {
      "object_key": "raw/flip2/zenodo-18433203-v3/hydro/to_P06241.csv.gz",
      "sha256": "7b7cb9f0116e851b37c45f2cfaa826ebb5f98ef5b2012cf6f95b36d42a4926c9",
      "size_bytes": 357257
    },
    {
      "object_key": "raw/flip2/zenodo-18433203-v3/hydro/to_P0A9X9.csv.gz",
      "sha256": "0eb15476975373a13b6e8faa44f71168d347ec364bd410beff9b9b929f6ae0f7",
      "size_bytes": 359737
    },
    {
      "object_key": "raw/flip2/zenodo-18433203-v3/hydro/to_P01053.csv.gz",
      "sha256": "99c116848319fcbe56f5fad654bc3c51fbc8c114b2d350425a60a811de43141c",
      "size_bytes": 361259
    }
  ],
  "schema_version": "1",
  "source_inventory": {
    "repository_path": "configs/datasets/flip2/zenodo-18433203-v3/hydro.json",
    "sha256": "d56bea2766c1501ee5d20f2db9f15cfb093160ad1f90ae71c29c58bf6d841c38"
  },
  "status": "succeeded",
  "task_id": "hydro",
  "verification": {
    "cos_readback_sha256_and_size_verified": true,
    "duplicate_write_rejected": true,
    "duplicate_write_status": "409 FileAlreadyExists",
    "manifest_exact_bytes_verified": true,
    "manifest_schema_verified": true,
    "publisher_md5_and_size_verified": true,
    "raw_object_count": 7
  },
  "verified_at": "2026-07-21T02:17:08Z"
}
